,id,text,created_at,author_id,retweet_count,like_count,reply_count,sentiment_score,sentiment_category,analysis_timestamp
0,1880683305684857019,"🎯 AI tools can analyze data in real time, giving businesses insights into customer behavior, trends, and pain points. Make data-driven decisions that lead to growth and improved strategy! 📊 #DataAnalytics #BusinessGrowth #AIInsights",2025-01-18T18:26:56.000Z,2671424650,0,0,0,0.6239,positive,2025-01-19T00:18:12.524223
1,1880604831657943061,"With AI-driven sales analytics, sales teams can analyze vast amounts of customer data, gaining insights into their preferences and pain points. This enables them to develop targeted solutions and build stronger, more meaningful relationships with their clients.",2025-01-18T13:15:06.000Z,1879930992384782350,0,0,0,0.659,positive,2025-01-19T00:18:13.289426
2,1880583054927815070,"When reviewing a branding project like Make Do Media, remember to analyze the target audience's needs and pain points to ensure the brand identity resonates with them",2025-01-18T11:48:34.000Z,1691371761248387072,0,0,0,0.2023,positive,2025-01-19T00:18:13.582998
3,1880526618516451535,"If You’re Not Using This, You’re Missing Out on Your Next Big Idea

I built an AI Agent that can analyze thousands of Tweets to uncover user pain points and identify product ideas that people are willing to pay for.

The best part? I’m saving all of these insights in a searchable… https://t.co/Dx91tCBuRw https://t.co/SsiphpQKXf",2025-01-18T08:04:19.000Z,562887391,0,3,1,-0.1779,negative,2025-01-19T00:18:13.853401
4,1880526560266199284,"If You’re Not Using This, You’re Missing Out on Your Next Big Idea

I built an AI Agent that can analyze thousands of Tweets to uncover user pain points and identify product ideas that people are willing to pay for.

The best part? I’m saving all of these insights in a searchable… https://t.co/UXK5FdftlH https://t.co/SPxu0KCp63",2025-01-18T08:04:05.000Z,562887391,0,0,0,-0.1779,negative,2025-01-19T00:18:14.107316
5,1880526489310908522,"If You’re Not Using This, You’re Missing Out on Your Next Big Idea

I built an AI Agent that can analyze thousands of Tweets to uncover user pain points and identify product ideas that people are willing to pay for.

The best part? I’m saving all of these insights in a searchable… https://t.co/QbIWErlw12 https://t.co/euVQv41lh2",2025-01-18T08:03:48.000Z,562887391,0,0,0,-0.1779,negative,2025-01-19T00:18:14.411903
6,1880277499252470209,"Are you losing potential customers every day?

AI steps in to save the day.

With AI, you can:

↳ Automate follow-ups at the perfect time.
↳ Analyze thousands of user behaviors in minutes.
↳ Identify pain points before they become deal-breakers.

Don't lose by ignoring Ai https://t.co/xyJ0FHf75t",2025-01-17T15:34:24.000Z,1875187172208246784,0,1,0,0.6722,positive,2025-01-19T00:18:14.769356
7,1880230810210734081,"RT @marcobatt: How I create tons of winning ads

- Find the best performing ones
- Analyze audience's pain points
- Make one variation at a…",2025-01-17T12:28:52.000Z,1417820532234354696,1,0,0,0.7506,positive,2025-01-19T00:18:15.025063
8,1879914606493061567,"Folashade Uba recommends using machine learning to analyze queries, uncover customer pain points, identify search intent, and spot patterns in this data.

https://t.co/Ak3Nuxyzxm https://t.co/9s0IduiFzV",2025-01-16T15:32:23.000Z,23752651,0,0,0,-0.34,negative,2025-01-19T00:18:15.335309
9,1879868137111224521,"🧑‍🤝‍🧑 Creating detailed buyer personas is crucial for effective marketing! Start by gathering data on demographics, behaviors, and pain points. Analyze your best customers and use insights to craft personas. 📊✨ 

Need a head start? Check out our FREE pers… https://t.co/30WMP4wI5Z",2025-01-16T12:27:44.000Z,1516169226804936707,0,0,0,0.8891,positive,2025-01-19T00:18:15.629289
